{
  "$schema": "./system-v2.schema.json",
  "contract_id": "dynamisdata-system",
  "version": "2.0.0",
  "status": "frozen",
  "authorities": {
    "scientific": "Python processor contracts with NumPy, SciPy, PyArrow, and declared deterministic parameters",
    "provenance": "Artifact identity, processing run, code SHA, method, and source lineage records",
    "rights": "Registry and rights evidence gates before acquisition, materialization, and serving",
    "ux": "React workbench with URL durable context, Query server state, Zustand transient state, and accessible renderer wrappers",
    "data": "Parquet immutable dense telemetry; PostgreSQL registry/control/Gold metadata; Arrow browser transport"
  },
  "deployment": {
    "frontend": "Vercel-hosted React/Vite workbench only",
    "api": "Cloud Run FastAPI container with PyArrow/DuckDB dense reads",
    "postgres": "Neon PostgreSQL preferred production control plane",
    "object_store": "Private R2-preferred S3-compatible object plane for immutable Parquet",
    "local_adapters": ["local filesystem artifact store", "local DuckDB", "Docker Compose"],
    "streaming": true
  },
  "performance_budgets": [
    {"id": "control_api_p95", "metric": "catalog/control request latency", "budget": 250, "unit": "ms p95", "scope": "local representative control reads", "evidence": "RES-109 baseline and acceptance receipt"},
    {"id": "dense_exact_p95", "metric": "standard exact dense window complete cost", "budget": 250, "unit": "ms p95", "scope": "bounded accepted/local window including Arrow serialization", "evidence": "e315adf benchmark matrix"},
    {"id": "dense_maximum_p95", "metric": "maximum allowed dense request complete cost", "budget": 1500, "unit": "ms p95", "scope": "accepted/local maximum bounded request", "evidence": "e315adf real maximum p50 907.81 ms"},
    {"id": "playback_chunk_p95", "metric": "bounded playback chunk fetch/decode", "budget": 250, "unit": "ms p95", "scope": "one HTTP Arrow chunk", "evidence": "accepted/local dense window budget"},
    {"id": "signal_first_plot_p95", "metric": "dense Signal first meaningful plot", "budget": 150, "unit": "ms p95", "scope": "100k browser points", "evidence": "e315adf uPlot median 76.1 ms"},
    {"id": "signal_update_p95", "metric": "dense Signal playhead update", "budget": 2, "unit": "ms p95", "scope": "100k browser points", "evidence": "e315adf browser probe"},
    {"id": "pose_frame_update_p95", "metric": "23-subject Pose typed-buffer update", "budget": 2, "unit": "ms p95", "scope": "23 subjects × 29 landmarks and all declared layers", "evidence": "e315adf prototype 0.087 ms"},
    {"id": "browser_playback_heap", "metric": "continuous playback browser heap", "budget": 256, "unit": "MB", "scope": "previous/active/next chunk cache", "evidence": "bounded three-chunk contract; acceptance receipt required"},
    {"id": "cloud_run_memory", "metric": "API container memory expectation", "budget": 2048, "unit": "MB", "scope": "initial Cloud Run sizing; tune from deployment evidence", "evidence": "accepted/local maximum window profile"},
    {"id": "cloud_run_concurrency", "metric": "API container concurrency expectation", "budget": 4, "unit": "in-flight requests", "scope": "dense maximum request class", "evidence": "e315adf four-request concurrency probe"}
  ],
  "dependency_policy": {
    "approved_core": ["React", "Vite", "TypeScript", "TanStack Router", "TanStack Query", "Zustand", "Tailwind", "Base UI", "Zod", "ECharts", "uPlot dense Signals", "PixiJS", "Three.js", "React Three Fiber", "Drei", "Apache Arrow", "Comlink", "FastAPI", "Pydantic", "PyArrow", "DuckDB", "PostgreSQL", "Dagster", "Alembic", "dbt-DuckDB", "Playwright", "axe"],
    "conditional": ["Three WebGPURenderer only after target-browser compatibility/performance evidence", "Polars only after measured transform hotspot", "Rust/PyO3 only after measured processor hotspot", "Rust/DataFusion only after Python dense service misses the frozen budget", "DuckDB-Wasm only as a future analyst sandbox", "three-mesh-bvh only after measured picking need"],
    "denied_without_adr": ["Redux", "MobX", "second general BI chart engine", "Babylon", "Unity", "DOM pitch replay", "MongoDB canonical/control data", "Timescale/ClickHouse duplication", "Kafka", "Spark", "Kubernetes", "whole-session browser telemetry", "opaque request-handler scientific recomputation"]
  },
  "decisions": [
    {"id": "signal-renderer", "selection": "uPlot owns dense Signal Laboratory rendering; ECharts remains general analytics", "evidence": "e315adf browser matrix: 100k first plot 76.1 ms vs 589.0 ms with parity probes", "fallback": "ECharts general analytical engine and deterministic renderer wrapper", "status": "frozen"},
    {"id": "pose-hot-path", "selection": "InstancedMesh plus batched dynamic BufferGeometry and typed-buffer useFrame mutation", "evidence": "e315adf: 23-subject objects/draw calls 2875/2875 to 7/7", "fallback": "WebGL2 Three/R3F primitive compatibility layer during migration", "status": "frozen"},
    {"id": "webgpu-default", "selection": "WebGL2 is the V2 default", "evidence": "e315adf target Chromium exposed WebGL2 but not WebGPU", "fallback": "future Three WebGPURenderer seam, never required for V2", "status": "frozen"},
    {"id": "dense-exact-read", "selection": "PyArrow dataset/window path owns exact and ordinary scoped windows", "evidence": "e315adf accepted/local and synthetic complete-path matrix", "fallback": "DuckDB exact path remains available for compatibility tests", "status": "frozen"},
    {"id": "dense-reduced-read", "selection": "DuckDB Parquet SQL owns broad/max display reduction and current min/max semantics", "evidence": "e315adf maximum allowed real class: DuckDB 1161.03 ms vs PyArrow 2228.46 ms direct candidate", "fallback": "bounded PyArrow reduction candidate behind unchanged response contract", "status": "frozen"},
    {"id": "native-dense-service", "selection": "No Rust/DataFusion service in V2", "evidence": "current Python service maximum class p50 907.81 ms below 1500 ms budget", "fallback": "Arrow boundary and unchanged API semantics if a future trigger is met", "status": "frozen"},
    {"id": "scientific-compute", "selection": "Python/NumPy/SciPy/PyArrow remains scientific authority", "evidence": "e315adf processor profile found no measured Polars or PyO3 trigger", "fallback": "isolated processor behind existing contract only after evidence", "status": "frozen"},
    {"id": "object-plane", "selection": "Private R2-preferred S3-compatible object storage with local filesystem adapter", "evidence": "RES-109 locked target topology and rights/provenance requirements", "fallback": "equivalent private S3-compatible provider", "status": "frozen"},
    {"id": "runtime-topology", "selection": "Vercel frontend plus Cloud Run FastAPI/PyArrow/DuckDB API", "evidence": "RES-109 locked split runtime and local container boundary", "fallback": "local Docker Compose; no Vercel Function dense service", "status": "frozen"}
  ],
  "modules": [
    {"id": "product-shell", "runtime_owner": "React 19/Vite browser shell", "state_owner": "component presentation plus explicit Router/Query/Zustand owners", "permitted_dependencies": ["React", "Vite", "TypeScript", "Tailwind", "Base UI", "Zod", "Playwright", "axe"], "forbidden_dependencies": ["Redux", "MobX", "duplicate server-data global store"], "transport": {"kind": "browser module graph", "formats": ["ES modules", "CSS"]}, "storage_authority": "none", "input_contract": {"description": "Route context, cached API contracts, and user events", "authority": "Router, Query, and accessibility contracts", "invariants": ["No dense row-object hot path", "No scientific recomputation"]}, "output_contract": {"description": "Accessible workbench surfaces and renderer lifecycle", "authority": "RES-101/RES-108 UX contract", "invariants": ["Responsive laboratory surfaces", "Keyboard and screen-reader wrapper"]}, "hot_path_ownership": "Lifecycle and composition only; no frame-rate data ownership", "scientific_authority": "None; delegates to API and canonical artifacts", "deployment_target": "Vercel", "benchmark_selected_implementation": "React/Vite shell retained", "fallbacks": ["static Vite preview", "local Docker web container"], "resource_performance_budgets": ["browser_playback_heap"], "feature_flags": [], "migration_status": "existing"},
    {"id": "durable-context", "runtime_owner": "TanStack Router", "state_owner": "URL search parameters", "permitted_dependencies": ["TanStack Router", "BigInt time conversion authority", "Zod"], "forbidden_dependencies": ["frame-cadence URL writes"], "transport": {"kind": "URL", "formats": ["validated search params"]}, "storage_authority": "browser URL", "input_contract": {"description": "Dataset/session/trial/subject/stream/time/metric context", "authority": "Router schema", "invariants": ["Signed canonical time", "Explicit commit boundary"]}, "output_contract": {"description": "Reloadable analytical context", "authority": "Router", "invariants": ["No transient playhead serialization"]}, "hot_path_ownership": "None", "scientific_authority": "Canonical time conversion only", "deployment_target": "Vercel browser", "benchmark_selected_implementation": "Existing TanStack Router provider", "fallbacks": ["default route context"], "resource_performance_budgets": [], "feature_flags": [], "migration_status": "existing"},